product_name,id,current_price,original_price,discount,discount_rate,short_description,rating_average,inventory_status,brand_name,product_link
Điện thoại Samsung Galaxy A13 (4GB/128GB) - Hàng chính hãng,170580388,3990000,4990000,1000000,20,"Điện thoại Samsung Galaxy A13 – Smartphone nhỏ gọn, ấn tượngSau Galaxy A12 thì Samsung lại tiếp tục chuẩn bị để cho ra mắt phiên bản kế nhiệm mang tên điện thoại Samsung Galaxy A13. Điện thoại Samsun...",4.8,available,Samsung,https://tiki.vn/product-p170580388.html?spid=170580391
Điện thoại Samsung Galaxy S22 Ultra 5G (8GB/128GB) - Hàng Chính Hãng,162593114,24990000,30990000,6000000,19,...,4.3,available,Samsung,https://tiki.vn/product-p162593114.html?spid=162593120
MỚI Điện thoại vivo T1x (8GB - 128GB) - Hàng Chính Hãng,184667324,5245000,6490000,1245000,19,...,0.0,available,Vivo,https://tiki.vn/product-p184667324.html?spid=184667326
Điện thoại Samsung Galaxy Z Flip 4 (8GB/128GB) - Hàng chính hãng,194034217,20490000,23990000,3500000,15,...,5.0,available,Samsung,https://tiki.vn/product-p194034217.html?spid=194034219
Điện thoại Samsung Galaxy Z Flip 4 (8GB/256GB) - Hàng chính hãng,194037967,22490000,25990000,3500000,13,...,5.0,available,Samsung,https://tiki.vn/product-p194037967.html?spid=194037971
Điện thoại Gaming Tecno POVA 3 (6GB)/128GB - Helio G88 | 7000 mAh | Sạc nhanh 33W - Hàng Chính Hãng,187266104,4290000,4990000,700000,14,"       RAM: 11GB* （6GB + 5GB RAM mở rộng）ROM: 128GBKích thước: 173.1*78.46* 9.44mmChipset: MediaTek G88, Octa coreMàn hình: 6.95”FHD+ H, 90 Hz RefreshRateKết...",4.7,available,Tecno,https://tiki.vn/product-p187266104.html?spid=187266106
Máy đọc sách All New Kindle Paperwhite 5 (11th Gen) - Hàng nhập khẩu,125182567,3730000,3990000,260000,7,Amazon vừa chính thức ra mắt thế hệ tiếp theo của dòng máy đọc sách Kindle Paperwhite.Kindle Paperwhite 5 (hay Kindle Paperwhite 11th Gen) là phiên bản thay thế cho chiếc Kindle Paperwhite 4 đã ra ...,5.0,available,Kindle,https://tiki.vn/product-p125182567.html?spid=127461186
Apple iPhone 13,184059211,19000000,24990000,5990000,24,iPhone 13. Hệ thống camera kép tiên tiến nhất từng có trên iPhone. Chip A15 Bionic thần tốc. Bước nhảy vọt về thời lượng pin. Thiết kế bền bỉ. Mạng 5G siêu nhanh.1 Cùng với màn hình Super Retina XDR s...,5.0,available,Apple,https://tiki.vn/product-p184059211.html?spid=123547399
"Apple iPad 10.2-inch (9th Gen) Wi-Fi, 2021",183330021,7790000,10990000,3200000,29,"Nội dung quảng cáoMạnh mẽ. Dễ sử dụng. Linh hoạt. iPad có màn hình Retina 10.2 inch tuyệt đẹp, chip A13 Bionic mạnh mẽ, camera trước Ultra Wide có tính năng Trung Tâm Màn Hình, tương thích với Apple ...",5.0,available,Apple,https://tiki.vn/product-p183330021.html?spid=124939769
Điện Thoại Nokia C30 (2GB/32GB) - Hàng Chính Hãng,120295859,1790000,1990000,200000,10,"Nokia C30 là dòng smartphone giá rẻ được Nokia chăm chút và đầu tư kỹ lưỡng với những nâng cấp đáng kể cả về ngoại hình lẫn hiệu năng, hứa hẹn mang đến cho người dùng những trải nghiệm tuyệt vời hơn b...",4.7,available,Nokia,https://tiki.vn/product-p120295859.html?spid=120295861
Apple iPhone 11,184036446,10950000,12990000,2040000,16,"Nội dung về tính năngQuay video 4K, chụp ảnh chân dung tuyệt đẹp và chụp phong cảnh rộng với hệ thống camera kép hoàn toàn mới. Chụp ảnh tối ưu trong điều kiện ánh sáng yếu với chế độ Ban Đêm. Xem ản...",4.8,available,Apple,https://tiki.vn/product-p184036446.html?spid=32033719
Điện thoại Xiaomi Redmi Note 11 (4GB/128GB) - Hàng chính hãng,160801751,4240000,4990000,750000,15,"Màn hình: AMOLED 6.43"", Full HD+ (2400x1080 Pixels)Hệ điều hành: Android 11Camera sau: 50 MP + 8 MP + 2 MP + 2 MPCamera trước: 13 MPChipset: Snapdragon 680RAM: 4 GBBộ nhớ trong: 128 GBCổng kết...",4.8,available,Xiaomi,https://tiki.vn/product-p160801751.html?spid=166542227
Điện Thoại Samsung Galaxy S20 FE 256GB | 8GB - Hàng Chính Hãng ,175967811,8850000,9950000,1100000,11," Màn hình giải trí siêu mượt 120 HzSamsung Galaxy S20 FE được trang bị màn hình siêu tràn viền Infinity-O có kích thước 6.5 inch đi cùng tấm nền Super AMOLED, độ phân giải Full HD+ cho người dùng dễ...",4.7,available,Samsung,https://tiki.vn/product-p175967811.html?spid=175967814
Điện Thoại Xiaomi Redmi Note 10S (8GB-128GB) - Hàng Chính Hãng,101615454,4710000,6490000,1780000,27,"Xiaomi công bố cho ra mắt Redmi Note 10S – dòng smartphone giá tầm trung đem lại chất lượng màn hình hiển thị cao, bộ bốn camera hỗ trợ chụp hình tối ưu, chipset Helio G95 và dung lượng pin lên đến 50...",4.7,available,Xiaomi,https://tiki.vn/product-p101615454.html?spid=102653828
Điện Thoại Oppo A55 (4GB/64GB) - Hàng Chính Hãng,132068858,3750000,4990000,1240000,25,"Lớp “áo” đẹp mãn nhãnĐiện Thoại Oppo A55 (4GB/64GB) có 2 biến thể màu gồm Starry Black (đen) và Rainbow Blue (xanh). Thiết kế cong 3D cùng kích thước mỏng nhẹ, OPPO A55 vừa vặn trong tay người cầm, c...",4.8,available,OPPO,https://tiki.vn/product-p132068858.html?spid=179554821
Điện thoại Samsung Galaxy S22 Ultra 5G (12GB/512GB) - Hàng Chính Hãng,162593187,28990000,36990000,8000000,22, ...,4.8,available,Samsung,https://tiki.vn/product-p162593187.html?spid=162593195
Điện thoại Samsung Galaxy A03 (3GB/32GB) - Hàng chính hãng,158714974,2390000,2990000,600000,20,"Sở hữu camera 48MP chụp hình sắc nét và viên pin siêu trâu 5.000mAh sử dụng đến hai ngày, điện thoại Samsung Galaxy A03 sẽ mang tới cho bạn những trải nghiệm cực kì ấn tượng trong phân khúc giá rẻ.Ca...",4.7,available,Samsung,https://tiki.vn/product-p158714974.html?spid=158714987
Điện thoại vivo Y22s (8GB - 128GB) - Hàng Chính Hãng,195323206,5460000,5990000,530000,9,"Vivo Y22s sở hữu màn hình IPS LCD 6.55 inches, ở mặt trước máy có màn hình viền mỏng với camera selfie hình giọt nước. Mặt sau là hệ thống camera kép khá to, với thiết kế đèn led đặt ngang một bên. Có...",0.0,available,Vivo,https://tiki.vn/product-p195323206.html?spid=197601470
Điện thoại Vivo Y02s  (3GB/32GB) - Hàng Chính Hãng,194125248,2995000,3490000,495000,14,"Y02s - một sản phẩm giá rẻ phù hợp với các bạn dùng học sinh - sinh viên, trang bị theo đó là hiệu năng có hiệu suất ổn định cùng một viên có thời lượng dùng lên đến cả ngày.• Vivo Y02s sử dụng công ...",0.0,available,Vivo,https://tiki.vn/product-p194125248.html?spid=194125250
Điện thoại Samsung Galaxy Z Fold 4 (12GB/256GB) - Hàng chính hãng,194041787,36490000,40990000,4500000,11,...,5.0,available,Samsung,https://tiki.vn/product-p194041787.html?spid=194041789
Máy tính bảng Samsung Galaxy Tab A7 Lite LTE SM-T225) - ĐÃ KÍCH HOẠT ĐIỆN TỬ - Hàng Chính Hãng,103168844,3250000,4990000,1740000,35,"Galaxy Tab A7 Lite 3GB/32GBGalaxy Tab A7 Lite là phiên bản rút gọn của dòng máy tính bảng ""ăn khách"" Galaxy Tab A7 thuộc thương hiệu Samsung, đáp ứng nhu cầu giải trí của khách hàng thuộc phân khúc b...",5.0,available,Samsung,https://tiki.vn/product-p103168844.html?spid=104310219
Điện Thoại Samsung Galaxy M32 (8GB/128GB) - Hàng Chính Hãng - Đã kích hoạt bảo hành điện tử,128865871,4460000,5990000,1530000,26,"Tối ưu không gian hiển thịMặt trước của máy được bao phủ bởi màn hình Super AMOLED 6.4 inch với độ phân giải Full HD+ mang đến trải nghiệm giải trí bao phủ, rõ ràng, màu sắc bắt mắt sinh động vô cùng...",4.8,available,Samsung,https://tiki.vn/product-p128865871.html?spid=128865875
Điện Thoại Oppo A16k (4GB/64G) - Hàng Chính Hãng,164937168,2950000,3790000,840000,22,https://cloud.opposhop.vn/index.php/s/I4hOjH8IGEWkf3V...,5.0,available,OPPO,https://tiki.vn/product-p164937168.html?spid=164937170
Điện thoại Samsung Galaxy A03s (4GB/64GB) - Hàng chính hãng,120450353,2990000,3690000,700000,19,"Thiết kế hiện đại, trẻ trungA03s sỡ hữu thiết kế tương tự như thế hệ trước, trẻ trung và hiện đại. Các cạnh của máy được vát cong cho khả năng cầm nắm tốt hơn, mặt lưng được phủ mờ giúp hạn chế trầy ...",4.8,available,Samsung,https://tiki.vn/product-p120450353.html?spid=126022664
Điện Thoại Nokia C20 2GB/16GB - Hàng Chính Hãng,135332196,1590000,2290000,700000,31,"Điện Thoại Nokia C20 2GB/16GB - Hàng Chính HãngBộ sản phẩm bao gồm: Thân máy, cáp micro USB, sạc, tai nghe, ốp silicon, sách hướng dẫn sử dụng. Thiết Kế Bền Bỉ Theo Thời Gian- Nokia C20 có thiết k...",4.8,available,Nokia,https://tiki.vn/product-p135332196.html?spid=140621854
Combo Máy đọc sách All New Kindle Paperwhite 5 (11th Gen) - 8Gb và Bao da - Hàng nhập khẩu,161964615,3730000,3990000,260000,7,Amazon vừa chính thức ra mắt thế hệ tiếp theo của dòng máy đọc sách Kindle Paperwhite.Kindle Paperwhite 5 (hay Kindle Paperwhite 11th Gen) là phiên bản thay thế cho chiếc Kindle Paperwhite 4 đã ra ...,5.0,available,Kindle,https://tiki.vn/product-p161964615.html?spid=161964617
Điện Thoại Xiaomi Redmi 9C 4GB/128GB - Hàng Chính Hãng,133811136,3490000,0,0,0,"Điện Thoại Xiaomi Redmi 9C 4GB/128GB - Hàng Chính HãngBộ sản phẩm bao gồm: Pin, sạc, cáp USB, cây tháo sim, sách hướng dẫn.Thông số kỹ thuậtMàn hình: IPS LCD, 6.53"", HD+Hệ điều hành:Android 10Cam...",4.7,discontinued,Xiaomi,https://tiki.vn/product-p133811136.html
Máy đọc sách Kindle Paperwhite 5 (8GB) - Hàng chính hãng,179547641,3729000,4990000,1261000,25,"- Màn hình : 6.8Inch, mật độ hiển thị màn hình 300ppi, đèn điều chỉnh 16 cấp độ- Kích thước : 4.9” x 6.9” x .32” (124.6 x 174.2 x 8.1 mm)- Trọng lượng : 7.23 oz (205 g)- Dung lượng : 8GB hoặc 32GB(bản...",4.8,available,Kindle,https://tiki.vn/product-p179547641.html?spid=179547642
Điện thoại Xiaomi Redmi 9A (2GB/32GB) - Hàng chính hãng,57809866,2120000,2490000,370000,15,"Màn hình giọt nước, viền máy mỏngDù thuộc phân khúc giá rẻ nhưng Điện thoại Xiaomi Redmi 9A lại sở hữu một màn hình tràn viền kích thước cực lớn 6.53 inch với thiết kế theo kiểu giọt nước quen thuộc,...",4.7,available,Xiaomi,https://tiki.vn/product-p57809866.html?spid=57809868
Điện thoại Samsung Galaxy A23 (4GB/128GB) - Hàng chính hãng,170581659,5390000,5690000,300000,5,"Điện thoại Samsung Galaxy A23 mạnh mẽ, mượt mà và camera chất lượngSamsung Galaxy A23 là thiết kế gây ấn tượng mạnh mẽ với người dùng bởi cấu hình ấn tượng cho hiệu năng mạnh mẽ. Bên cạnh đó là tần s...",0.0,available,Samsung,https://tiki.vn/product-p170581659.html?spid=184226480
Điện Thoại Oppo A16 (4GB/64G) - Hàng Chính Hãng,114766715,2990000,3990000,1000000,25,"Thiết kế hiện đại, vẻ ngoài cá tínhĐiện Thoại Oppo A16 có thiết kế mang đến cho người dùng cảm giác mạnh mẽ, cá tính nhưng cũng không kém phần sang trọng, mỏng chỉ 8.4 mm với mặt kính cường lực Panda...",5.0,available,OPPO,https://tiki.vn/product-p114766715.html?spid=114766722
Điện Thoại Nokia G21 (4GB/128GB) - Hàng Chính Hãng,179438706,3550000,0,0,0,"Thiết kế trẻ trungẤn tượng đầu tiên khi mà mình cầm chiếc điện thoại Nokia G21 trên tay là tổng thể của máy khá lớn, mặt lưng được làm từ vật liệu nhựa cùng kiểu thiết kế vân ngang, tạo cho mình một ...",4.7,out_of_stock,Nokia,https://tiki.vn/product-p179438706.html
Tecno Pova 2 6GB l 128GB - Điện Thoại Thông Minh Chiến Game Cực Đỉnh - Hàng Chính Hãng,103046198,3590000,4990000,1400000,28,"Tecno POVA 2 là sự kế thừa trực tiếp của POVA năm ngoái . CPU hiện đã tốt hơn một chút, màn hình hiển thị lớn hơn, nhưng quan trọng nhất là pin hiện đã được đẩy lên 7000mAh, đây là sản phẩm đầu tiên c...",4.8,available,Tecno,https://tiki.vn/product-p103046198.html?spid=168423771
Máy Tính Bảng Samsung Galaxy Tab A7 Lite T225 3GB/32GB - Hàng Chính Hãng,121059239,3289000,4990000,1701000,34,"Máy Tính Bảng Samsung Galaxy Tab A7 Lite T225 3GB/32GB - Hàng Chính HãngBộ sản phẩm bao gồm: Thân máy, sạc, cáp dữ liệu, tài liệu hướng dẫn sử dụng, dụng cụ lấy sim và lấy thẻ nhớ. Trọng lượng chỉ ...",5.0,available,Samsung,https://tiki.vn/product-p121059239.html?spid=121059243
Máy Đọc Sách All New Kindle 2019 8GB (10th) – Hàng Chính Hãng,179549113,2160000,2990000,830000,28,Màn hình cảm ứng điện dungMáy Đọc Sách New Kindle Gen 10 (2019) có màn hình cảm ứng điện dung E Ink Carta HD 6 inch với độ phân giải 1430 × 1080 và mật độ hiên thị 167ppi cho hình ảnh và chữ vô cùng ...,4.6,available,Kindle,https://tiki.vn/product-p179549113.html?spid=179549114
Máy đọc sách Kindle PaperWhite Gen 4 (10th) - Bản 8GB - Hàng chính hãng,6597807,2910000,3990000,1080000,27,"Thiết kế mỏng nhẹMáy đọc sách Kindle PaperWhite gen 4 (10th) - Bản 8 GB - Hàng chính hãng được thiết kế cực kỳ mỏng, nhẹ và màn hình sáng hơn. Trọng lượng của máy là 182 gram và dày 8,18 mm, so ...",4.7,available,Kindle,https://tiki.vn/product-p6597807.html?spid=56947752
Điện Thoại Nokia C20 2GB/32GB - Hàng Chính Hãng,135322157,1790000,2490000,700000,28,"Điện Thoại Nokia C20 2GB/32GB - Hàng Chính HãngBộ sản phẩm bao gồm: Thân máy, cáp micro USB, sạc, tai nghe, ốp silicon, sách hướng dẫn sử dụng. Thiết Kế Bền Bỉ Theo Thời Gian- Nokia C20 có thiết k...",4.5,available,Nokia,https://tiki.vn/product-p135322157.html?spid=176059930
Máy tính bảng Samsung Galaxy Tab A7 Lite LTE SM-T225 - Hàng Chính Hãng,103168071,3299000,4490000,1191000,27,"Chính hãng, Nguyên seal, Mới 100%Đã kích hoạt bảo hành điện tử 6060, nguyên seal chưa khuiMiễn phí giao hàng toàn quốcSIM Nano-SIM, hỗ trợ 4GLoại Màn hình cảm ứng IPS LCDKích thước: 8.7 incheĐộ phân g...",4.8,available,Samsung,https://tiki.vn/product-p103168071.html?spid=109020288
Máy Tính Bảng Huawei Matepad T10s | Màn Hình Full HD | Chế Độ Bảo Vệ Mắt | Tinh Chỉnh Bởi Harman Kardon | Hàng Chính Hãng,75321722,3675000,5990000,2315000,39,"HUAWEI Matepad T10S sử dụng dịch vụ Huawei Mobile Service (HMS), dịch vụ Google sẽ không cài đặt sẵn trên thiết bị.Để biết thêm thông tin chi tiết, vui lòng liên hệ nhân viên để được hỗ trợXin cảm ơn ...",4.6,available,Huawei,https://tiki.vn/product-p75321722.html?spid=142384384
Apple iPhone 14 Pro,197216279,29990000,30990000,1000000,3,"Nội dung quảng cáoiPhone 14 Pro. Bắt trọn chi tiết ấn tượng với Camera Chính 48MP. Trải nghiệm iPhone theo cách hoàn toàn mới với Dynamic Island và màn hình Luôn Bật. Phát Hiện Va Chạm,1 một tính năn...",5.0,available,Apple,https://tiki.vn/product-p197216279.html?spid=197216281
Điện thoại Samsung Galaxy A32-Hàng Chính Hãng,88100671,5080000,5290000,210000,4,"Bứt Phá Chuẩn Công Nghệ Thăng Hạng Ngàn Trải NghiệmThao Tác Mượt Mà Trên Màn Hình Tuyệt ĐỉnhMãn nhãn với những hình ảnh chi tiết, rực rỡ trên màn hình Super AMOLED chuẩn FHD+ với độ sáng lên đến 80...",4.7,available,Samsung,https://tiki.vn/product-p88100671.html?spid=93722334
Điện thoại Samsung Galaxy A13 (4GB/128GB) - Hàng chính hãng,170580388,3990000,4990000,1000000,20,"Điện thoại Samsung Galaxy A13 – Smartphone nhỏ gọn, ấn tượngSau Galaxy A12 thì Samsung lại tiếp tục chuẩn bị để cho ra mắt phiên bản kế nhiệm mang tên điện thoại Samsung Galaxy A13. Điện thoại Samsun...",4.8,available,Samsung,https://tiki.vn/product-p170580388.html?spid=170580391
Điện thoại Samsung Galaxy S22 Plus 5G (8GB/256GB) - Hàng chính hãng,162583980,19390000,27490000,8100000,29,...,4.5,available,Samsung,https://tiki.vn/product-p162583980.html?spid=162583984
MỚI Điện thoại vivo T1x (8GB - 128GB) - Hàng Chính Hãng,184667324,5245000,6490000,1245000,19,...,0.0,available,Vivo,https://tiki.vn/product-p184667324.html?spid=184667326
Điện thoại Samsung Galaxy A03 (3GB/32GB) - Hàng chính hãng,158714974,2390000,2990000,600000,20,"Sở hữu camera 48MP chụp hình sắc nét và viên pin siêu trâu 5.000mAh sử dụng đến hai ngày, điện thoại Samsung Galaxy A03 sẽ mang tới cho bạn những trải nghiệm cực kì ấn tượng trong phân khúc giá rẻ.Ca...",4.7,available,Samsung,https://tiki.vn/product-p158714974.html?spid=158714987
Điện Thoại Nokia 105 Single Sim - Hàng Chính Hãng,34942696,539000,549000,10000,2,"Thiết kế nhỏ gọn, đẹp mắtĐiện Thoại Nokia 105 Single Sim có thiết kế hiện đại với các đường bo tròn độc đáo cho bạn dễ dàng cầm giữ cũng như bỏ máy vào túi. Kiểu dáng thanh lịch, cá tính và năng động...",4.5,available,Nokia,https://tiki.vn/product-p34942696.html?spid=136097920
Điện Thoại Oppo A57 (4GB/64GB) - Hàng Chính Hãng,189658085,3790000,4490000,700000,16,  ...,4.8,available,OPPO,https://tiki.vn/product-p189658085.html?spid=189658087
Điện thoại bàn KX-TS500 hàng chính hãng,163914808,290000,290000,0,0,"Treo tường hoặc để bànĐiều chỉnh âm lượng, chuôngQuay số nhanhĐèn tín hiệuBảo hành 1 năm chính hãng Panasonic Giá bán đã thuế 10% VAT...",5.0,available,Panasonic,https://tiki.vn/product-p163914808.html?spid=163914810
Điện Thoại Nokia C01 Plus 2GB/16GB - Hàng Chính Hãng,119464777,1569000,1879000,310000,16,"Điện Thoại Nokia C01 Plus 2GB/16GB - Hàng Chính HãngBộ sản phẩm bao gồm: Thân máy, cáp micro USB, sạc, tai nghe, ốp silicon, sách hướng dẫn sử dụng.Nokia vẫn luôn giữ vững phong độ trên thị trường s...",4.5,available,Nokia,https://tiki.vn/product-p119464777.html?spid=138826717
Điện Thoại Samsung A13 4GB/128GB - Hàng Chính Hãng,172309326,3709000,4690000,981000,21,"Điện Thoại Samsung A13 4GB/128GB - Hàng Chính HãngBộ sản phẩm bao gồm: Thân máy, sạc, cáp dữ liệu, tài liệu hướng dẫn, dụng cụ lấy sim và lấy thẻ nhớ. Thiết Kế Tối Giản- Trang bị màn hình Full HD+...",4.8,available,Samsung,https://tiki.vn/product-p172309326.html?spid=172309328
Điện Thoại Để Bàn Panasonic KX-TS500MX - Hàng Chính Hãng,23865953,274000,274000,0,0,ĐIỆN THOẠI BÀN CÓ DÂY PANASONIC KX-TS500MX•Điều chỉnh âm lượng điện tử •Chức năng quay lại số vừa gọi •Giá treo tường • Có phím FLASH - Dùng để chuyển máy nội nộ•Kiểu chuông 3 cấp độ •Cài chế độ bậ...,4.8,available,Panasonic,https://tiki.vn/product-p23865953.html?spid=117785985
Điện thoại Xiaomi 11T (8GB/128GB) - Hàng chính hãng,127058581,10990000,10990000,0,0,"Vẻ ngoài tối giản, phù hợp với mọi đối tượngĐiện thoại Xiaomi 11T được hoàn thiện từ sự kết hợp hài hòa giữa khung kim loại và mặt lưng kính cường lực, không chỉ đẹp mà còn bền. Máy có trọng lượng 20...",4.8,available,Xiaomi,https://tiki.vn/product-p127058581.html?spid=127058583
"Điện thoại TECNO Spark 8C (3GB/64GB) - Pin 5000 mAh 6.6"" HD+ 90Hz - Hàng chính hãng",198587877,2210000,2480000,270000,11, Thông số kỹ thuậtCông nghệ Memory Fusion (Bộ Nhớ Hợp Nhất) được thiết kế để tận dụng bộ nhớ chỉ đọc (ROM) không được sử dụng và chuyển chúng cho các hoạt động của RAM. Một điệ...,4.5,available,Tecno,https://tiki.vn/product-p198587877.html?spid=195319304
"Apple iPad mini (6th Gen) Wi-Fi, 2021",184248127,12990000,14990000,2000000,13,iPad mini. Thiết kế màn hình toàn phần với màn hình Liquid Retina 8.3 inch.1 Chip A15 Bionic mạnh mẽ với Neural Engine. Camera trước Ultra Wide 12MP với tính năng Trung Tâm Màn Hình. Cổng kết nối USB-...,5.0,available,Apple,https://tiki.vn/product-p184248127.html?spid=124944089
Điện Thoại Nokia C21 Plus (3GB/32GB) - Hàng Chính Hãng,179930699,2350000,2890000,540000,19,"Hiệu năng ổn định, bảo mật 2 nămĐiện Thoại Nokia C21 Plus được trang bị bộ vi xử lý Unisoc SC9863A tám lõi với tốc độ xung nhịp 1.6 GHz, đi cùng RAM 3 GB và bộ nhớ trong 64 GB, có một khe cắm thẻ nhớ...",5.0,available,Nokia,https://tiki.vn/product-p179930699.html?spid=179930701
Điện thoại Samsung Galaxy S22 Ultra 5G (12GB/256GB) - Hàng Chính Hãng,162593136,26990000,33990000,7000000,21, ...,0.0,available,Samsung,https://tiki.vn/product-p162593136.html?spid=170728628
Máy đọc sách All New Kindle Paperwhite 5 (11th Gen) - Hàng nhập khẩu,125182567,3730000,3990000,260000,7,Amazon vừa chính thức ra mắt thế hệ tiếp theo của dòng máy đọc sách Kindle Paperwhite.Kindle Paperwhite 5 (hay Kindle Paperwhite 11th Gen) là phiên bản thay thế cho chiếc Kindle Paperwhite 4 đã ra ...,5.0,available,Kindle,https://tiki.vn/product-p125182567.html?spid=127461186
Điện thoại Samsung Galaxy A04s (4GB/64GB) - Hàng chính hãng,197670818,3590000,3990000,400000,10,"Dung lượng pin lớn 5000mAh, Galaxy A04s đáp ứng đầy đủ nhu cầu giải trí liền mạch, kéo dài thời gian sử dụng lên đến 2 ngày.Sở hữu Công nghệ Sạc Nhanh 15W (*) (an toàn cho thiết bị), giúp bạn bắt nhịp...",4.0,available,Samsung,https://tiki.vn/product-p197670818.html?spid=197670820
"ĐIỆN THOẠI TÂN CỔ ĐIỂN DT4  bàn phím quay , dùng cáp điện thoại cố định nghe gọi âm thanh rõ ràng (điện thoại bàn tân cổ điển)",70839193,1890000,2100000,210000,10,"Kích thước : 26 x 18 x 21 cmChất liệu: Composite mạ đồngĐiện thoại dùng lắp như điện thoại bàn cho khách hàng lựa chọnHộp đóng mở bàn phím gọn gàng, chuông thanh bàn phím quay, nghe gọi rõ ràngKiểu Dá...",1.0,available,OEM,https://tiki.vn/product-p70839193.html?spid=70839194
Combo Máy đọc sách All New Kindle Paperwhite 5 (11th Gen) - 8Gb và Bao da - Hàng nhập khẩu,161964615,3730000,3990000,260000,7,Amazon vừa chính thức ra mắt thế hệ tiếp theo của dòng máy đọc sách Kindle Paperwhite.Kindle Paperwhite 5 (hay Kindle Paperwhite 11th Gen) là phiên bản thay thế cho chiếc Kindle Paperwhite 4 đã ra ...,5.0,available,Kindle,https://tiki.vn/product-p161964615.html?spid=161964617
Điện Thoại Nokia 215 4G - Hàng Chính Hãng,72882726,849000,900000,51000,6,"Thiết kế đơn giản, gọn nhẹĐiện Thoại Nokia 215 4G sử dụng chất liệu nhựa cho kiểu dáng bền bỉ, các nút cảm ứng mềm lớn, cạnh dễ cầm và mặt lưng cong được thiết kế để vừa vặn hoàn toàn trong tay b...",4.5,available,Nokia,https://tiki.vn/product-p72882726.html?spid=77775162
Điện Thoại Samsung Galaxy M12 (3GB/32GB) - Hàng Chính Hãng,89888994,2849000,3490000,641000,18,"Cấu hình mạnh mẽ với vi xử lý 8 nhân tối ưu và tần số quét 90HzĐiện Thoại Samsung Galaxy M12 với tần số quét màn hình 90Hz, lớn bậc nhất phân khúc, hiển thị mượt mà mọi chuyển động dù là nhỏ nhất trê...",4.8,available,Samsung,https://tiki.vn/product-p89888994.html?spid=146648973
Điện Thoại Thông Minh Xiaomi Poco F3 8GB l 256GB - Hàng Chính Hãng,99862142,9990000,9990000,0,0,"Sở hữu sức mạnh “vô đối” đến từ CPU của nhà Qualcomm, Xiaomi POCO F3 mang đến người dùng cơ hội trải nghiệm hiệu năng của flagship hàng đầu trong mức giá tầm trung, một “món hời” mà các tín đồ “hệ gam...",4.7,available,Xiaomi,https://tiki.vn/product-p99862142.html?spid=107535103
Điện thoại Samsung Galaxy A53 5G (8GB/128GB) - Hàng chính hãng,170497385,7890000,9990000,2100000,21,...,5.0,available,Samsung,https://tiki.vn/product-p170497385.html?spid=170497389
Điện Thoại OnePlus 10T 5G - Hàng Chính Hãng,193310183,16990000,17990000,1000000,6,"OnePlus là minh chứng cho một hãng smartphone bền vững với nhiều sản phẩm điện thoại cấu hình tốt trong tầm giá, điển hình là điện thoại OnePlus 10T. Sản phẩm này, cùng với ...",5.0,available,OnePlus ,https://tiki.vn/product-p193310183.html?spid=193310187
Máy đọc sách Kobo Clara HD - Hàng Chính Hãng,120766388,3250000,3250000,0,0,GIỚI THIỆUKobo Clara là dòng máy đọc sách 6inch nhỏ gọn với các tính năng mà chỉ xuất hiện ở các dòng máy đọc sách cao cấp. Tự tin là máy đọc sách không có đối thủ trong phân khúc..Sản phù hợp đáp ứ...,5.0,available,Kobo,https://tiki.vn/product-p120766388.html?spid=137948561
